twitter_data_summary.csv

,NumNewDiscussions_0,NumNewDiscussions_1,NumNewDiscussions_2,NumNewDiscussions_3,NumNewDiscussions_4,NumNewDiscussions_5,NumNewDiscussions_6,NumNewAuthors_0,NumNewAuthors_1,NumNewAuthors_2,NumNewAuthors_3,NumNewAuthors_4,NumNewAuthors_5,NumNewAuthors_6,AttentionPaid_0,AttentionPaid_1,AttentionPaid_2,AttentionPaid_3,AttentionPaid_4,AttentionPaid_5,AttentionPaid_6,BurstinessLevel_0,BurstinessLevel_1,BurstinessLevel_2,BurstinessLevel_3,BurstinessLevel_4,BurstinessLevel_5,BurstinessLevel_6,NumAtomicContainers_0,NumAtomicContainers_1,NumAtomicContainers_2,NumAtomicContainers_3,NumAtomicContainers_4,NumAtomicContainers_5,NumAtomicContainers_6,NumContributions_0,NumContributions_1,NumContributions_2,NumContributions_3,NumContributions_4,NumContributions_5,NumContributions_6,ContributionSpread_0,ContributionSpread_1,ContributionSpread_2,ContributionSpread_3,ContributionSpread_4,ContributionSpread_5,ContributionSpread_6,AuthorInteraction_0,AuthorInteraction_1,AuthorInteraction_2,AuthorInteraction_3,AuthorInteraction_4,AuthorInteraction_5,AuthorInteraction_6,NumAuthorsInteracting_0,NumAuthorsInteracting_1,NumAuthorsInteracting_2,NumAuthorsInteracting_3,NumAuthorsInteracting_4,NumAuthorsInteracting_5,NumAuthorsInteracting_6,AverageDiscussionLength_0,AverageDiscussionLength_1,AverageDiscussionLength_2,AverageDiscussionLength_3,AverageDiscussionLength_4,AverageDiscussionLength_5,AverageDiscussionLength_6,NumDiscussions_0,NumDiscussions_1,NumDiscussions_2,NumDiscussions_3,NumDiscussions_4,NumDiscussions_5,NumDiscussions_6,buzz,DiscussionsPerAuthor_0,DiscussionsPerAuthor_1,DiscussionsPerAuthor_2,DiscussionsPerAuthor_3,DiscussionsPerAuthor_4,DiscussionsPerAuthor_5,DiscussionsPerAuthor_6,AttentionPerAuthor_0,AttentionPerAuthor_1,AttentionPerAuthor_2,AttentionPerAuthor_3,AttentionPerAuthor_4,AttentionPerAuthor_5,AttentionPerAuthor_6
count,583250.0,583250.0,583250.0,583250.0,583250.0,583250.0,583250.0,583250.0,583250.0,583250.0,583250.0,583250.0,583250.0,583250.0,583250.0,583250.0,583250.0,583250.0,583250.0,583250.0,583250.0,583250.0,583250.0,583250.0,583250.0,583250.0,583250.0,583250.0,583250.0,583250.0,583250.0,583250.0,583250.0,583250.0,583250.0,583250.0,583250.0,583250.0,583250.0,583250.0,583250.0,583250.0,583250.0,583250.0,583250.0,583250.0,583250.0,583250.0,583250.0,583250.0,583250.0,583250.0,583250.0,583250.0,583250.0,583250.0,583250.0,583250.0,583250.0,583250.0,583250.0,583250.0,583250.0,583250.0,583250.0,583250.0,583250.0,583250.0,583250.0,583250.0,583250.0,583250.0,583250.0,583250.0,583250.0,583250.0,583250.0,583250.0,583250.0,583250.0,583250.0,583250.0,583250.0,583250.0,583250.0,583250.0,583250.0,583250.0,583250.0,583250.0,583250.0,583250.0
mean,140.33963994856407,136.77014659237034,159.6792713244749,181.5920908701243,201.09744534933563,220.17537076725247,219.3882143163309,71.0380505786541,69.82963051864552,82.1982031718817,93.77481868838406,103.8956948135448,113.61114102014574,112.94092070295757,0.00020248542477496786,0.00019633430261465924,0.00022085228632661807,0.00024156211230175737,0.0002609083754822117,0.00028204029318474065,0.0002789295790827261,0.9253900605675096,0.9181458386712389,0.907051812810973,0.919953864336048,0.9306565236365195,0.9560700619854264,0.955340904471496,150.66249978568368,146.6417419631376,170.72146078011144,193.7858911273039,214.1957685383626,234.21782083154736,233.23609601371624,0.0001140425872267467,0.00011073624174882126,0.00012442545220745822,0.000135897117873982,0.00014668654607801114,0.0001587056048006858,0.00015710724732104586,0.9308015430775826,0.9230621517359623,0.9116073724817831,0.9245812258894128,0.9353707672524646,0.960881268752679,0.9606258036862408,1.0454998286823833,1.0351942506489498,1.0170435393587656,1.0326343848812687,1.045863151660523,1.0781222648881268,1.0817588754290612,123.06372567509644,119.5795062151736,138.95852036005144,157.4239228461209,173.70211401628805,189.5214779254179,188.41027861123018,1.0952554135396486,1.08372322398114,1.066749364588084,1.0852139426935277,1.1002145858105445,1.136688269344192,1.140372144606944,140.78986026575225,137.1812704672096,160.10592198885556,182.0574402057437,201.59648178311187,220.70589969995714,219.9368641234462,191.27949335619374,0.8798484172247126,0.8733346787242399,0.8612531330359405,0.8730325302996841,0.882669582030836,0.9055803435632414,0.9048707578296457,0.4985467038625489,0.4944242694479539,0.49779142150283,0.5093458791491078,0.5192893782384558,0.5398479663356688,0.5391740097626826
std,431.77263864993927,432.30512909849256,502.0574278556871,574.8837134622214,630.4484324117425,669.2059301972694,672.1822040497915,196.87671789431926,202.1997579876114,239.52304183308692,278.89240333572957,309.197402756638,326.0769003889321,326.0153213806718,0.000565919211549771,0.000553706428696004,0.000605621763315704,0.0006554458659820727,0.0007002979987953691,0.0007332518496263378,0.0007253341641553624,0.25550109732728693,0.26774997190893246,0.2845645737086332,0.26501412824706055,0.24708399998574337,0.19598233332851403,0.19699682018176798,453.68897648511467,452.0392932408021,523.8017302121248,598.2875994775047,654.4689732514524,694.1659469036232,696.4195183924488,0.0003482845502072692,0.00034224258598380513,0.0003688463235014257,0.00039356951801366454,0.00041687306269430846,0.00043589068509966117,0.00043160139286963476,0.25379153042435126,0.26649303467820085,0.28386530093458145,0.2640660943362708,0.24587069501974096,0.19387759169019872,0.19448376237798984,1.3594347434431082,1.4696969951228147,1.2081219874464426,1.2502181008581368,1.2863312187191334,1.3000133153040434,1.4228993088438735,350.2153224531354,347.2365774732342,403.60342970350183,460.88436450742194,503.66082243893766,532.3154954800934,531.152777665584,1.487984893761712,1.5868634673390856,1.3157796419479413,1.3707434049677922,1.405730575584664,1.4323272443439592,1.5523131926375051,432.6249535382536,433.02661139649456,502.77440756340144,575.6580220914842,631.2583177290344,670.0509770859896,673.0325412468351,612.352353948702,0.2656977417464858,0.2759614235577344,0.29008957113112327,0.2732630236044655,0.25816243150048607,0.21672797565297366,0.21772922309463855,0.3160082833429758,0.2936146867807245,0.3170547761982457,0.3409791395517936,0.3718968153243702,0.3834336564544332,0.3830694035027629
min,0.0,0.0,0.0,0.0,0.0,0.0,0.0,0.0,0.0,0.0,0.0,0.0,0.0,0.0,0.0,0.0,0.0,0.0,0.0,0.0,0.0,0.0,0.0,0.0,0.0,0.0,0.0,0.0,0.0,0.0,0.0,0.0,0.0,0.0,0.0,0.0,0.0,0.0,0.0,0.0,0.0,0.0,0.0,0.0,0.0,0.0,0.0,0.0,0.0,0.0,0.0,0.0,0.0,0.0,0.0,0.0,0.0,0.0,0.0,0.0,0.0,0.0,0.0,0.0,0.0,0.0,0.0,0.0,0.0,0.0,0.0,0.0,0.0,0.0,0.0,0.0,0.0,0.0,0.0,0.0,0.0,0.0,0.0,0.0,0.0,0.0,0.0,0.0,0.0,0.0,0.0,0.0
25%,3.0,3.0,4.0,4.0,5.0,6.0,6.0,2.0,2.0,2.0,3.0,3.0,4.0,4.0,4e-06,4e-06,5e-06,6e-06,7e-06,8e-06,8e-06,1.0,1.0,1.0,1.0,1.0,1.0,1.0,3.0,3.0,4.0,5.0,5.0,7.0,7.0,2e-06,2e-06,3e-06,3e-06,3e-06,4e-06,4e-06,1.0,1.0,1.0,1.0,1.0,1.0,1.0,1.0,1.0,1.0,1.0,1.0,1.0,1.0,3.0,3.0,4.0,4.0,5.0,6.0,6.0,1.0,1.0,1.0,1.0,1.0,1.0,1.0,3.0,3.0,4.0,4.0,5.0,6.0,6.0,4.5,0.9090909090909091,0.9070294784580498,0.8960872573961487,0.9032701541162229,0.9090909090909091,0.9202751806851128,0.9199995952001782,0.46153846153846156,0.4583333333333333,0.4592986562156049,0.46153846153846156,0.4651747758091041,0.4700854700854701,0.468858011519745
50%,18.0,17.0,21.0,24.0,27.0,31.0,30.0,11.0,11.0,13.0,14.0,16.0,19.0,18.0,2.6e-05,2.5e-05,2.9e-05,3.3e-05,3.7e-05,4.2e-05,4.1e-05,1.0,1.0,1.0,1.0,1.0,1.0,1.0,20.0,19.0,23.0,26.0,30.0,34.0,34.0,1.4e-05,1.3e-05,1.6e-05,1.8e-05,2e-05,2.3e-05,2.3e-05,1.0,1.0,1.0,1.0,1.0,1.0,1.0,1.0,1.0,1.0,1.0,1.0,1.0,1.0,17.0,17.0,20.0,22.0,25.0,29.0,28.0,1.0,1.0,1.0,1.0,1.0,1.0,1.0,18.0,17.0,21.0,24.0,27.0,31.0,31.0,25.5,1.0,1.0,1.0,1.0,1.0,1.0,1.0,0.5,0.5,0.5,0.5,0.5,0.5,0.5
75%,104.0,100.0,115.0,131.0,147.0,166.0,164.0,59.0,57.0,65.0,74.0,82.0,92.0,91.0,0.000156,0.000149,0.00017,0.00019,0.00021,0.000232,0.000228,1.0,1.0,1.0,1.0,1.0,1.0,1.0,113.0,108.0,125.0,143.0,161.0,181.0,179.0,8.5e-05,8.2e-05,9.4e-05,0.000106,0.000117,0.00013,0.000128,1.0,1.0,1.0,1.0,1.0,1.0,1.0,1.052632,1.05,1.054054,1.056818,1.058824,1.063063,1.063323,96.0,92.0,105.0,118.0,132.0,148.0,146.0,1.074419,1.071429,1.076923,1.081081,1.0836109999999999,1.090909,1.091296,104.0,101.0,115.0,131.0,148.0,167.0,165.0,139.0,1.0,1.0,1.0,1.0,1.0,1.0,1.0,0.5565217391304348,0.5555555555555556,0.558139534883721,0.5609756097560975,0.5632183908045977,0.5709165839304913,0.5706405278157871
max,24210.0,29574.0,37505.0,72366.0,79079.0,79079.0,79079.0,18654.0,22035.0,29402.0,57617.0,63147.0,63147.0,63147.0,0.024997,0.029403,0.040258,0.081081,0.094585,0.094585,0.094585,1.0,1.0,1.0,1.0,1.0,1.0,1.0,26644.0,29574.0,37505.0,72397.0,79136.0,79136.0,79136.0,0.022498,0.022498,0.022498,0.040198,0.045964,0.045964,0.045964,1.0,1.0,1.0,1.0,1.0,1.0,1.0,282.0,283.0,283.0,263.0,282.0,249.0,283.0,21723.0,26134.0,34085.0,64984.0,72159.0,72159.0,72159.0,294.0,295.0,295.0,273.0,294.0,262.0,295.0,24301.0,29574.0,37505.0,72366.0,79083.0,79083.0,79083.0,75724.5,1.0,1.0,1.0,1.0,1.0,1.0,1.0,63.111111111111114,41.714285714285715,51.0,51.0,63.111111111111114,63.111111111111114,63.111111111111114

README.md

# EDA

**NumNewDiscussions:** We note that NumNewDiscussions has a large range of [0.0, 79079.0]. Each of the features have a mean ranging from [136.77, 220.18], and the std is greater than 3x the mean.

**NumNewAuthors:** NumNewAuthors has a range of [0.0, 63147.0]. Each of the timestamped features have a mean ranging from [69.83, 113.61]. The std for these features is around 3x the mean.

**NumAtomicContainers:** NumAtomicContainers has a range of [0.0, 79136.0]. The mean ranges from [146.64, 234.22]. The std is 3x the mean.

**NumContributions:** NumContributions has a range of [0.0, 0.0460]. The mean ranges from [0.0001, 0.0002]. The std is 2-3x the mean.

**ContributionSpread:** ContributionSpread has a range [0.0, 1.0]. The mean ranges from [0.9116, 0.9609]. The std is 1/4x the mean.

**AuthorInteraction:** The range is from [0.0, 283.0]. The mean ranges from [1.0170, 1.0818]. The std is 1.2-1.5x the mean.

**NumAuthorsInteracting:** The range is from [0.0, 72159.0]. The mean ranges from [119.58, 189.52]. The std is 2-3x the mean.

**AverageDiscussionLength:** The range is from [0.0, 295.0]. The mean ranges from [1.0667, 1.1404]. The std is 1.3-1.4x the mean.

**NumDiscussions:** The range is from [0.0, 79083.0]. The mean ranges from [137.18, 220.71]. The std is 2-3x the mean.

**DiscussionsPerAuthor:** The range is from [0.0, 1.0]. The mean ranges from [0.8613, 0.9056]. The std is 1/3 the mean.

**AttentionPerAuthor:** The range is from [0.0, 63.111]. The mean ranges from [0.4944, 0.5398]. The std is 0.5-0.6x the mean.